{
  "schema_version": "crypto.strategy-instance.v1",
  "strategy_id": "perp_sma12_24_long_short",
  "strategy_version": "v1",
  "parameters": {
    "fast_window": 12,
    "slow_window": 24,
    "effective_leverage": "1",
    "max_leverage": "5"
  },
  "venues": ["hyperliquid", "mexc"],
  "market_types": ["perpetual"],
  "interval": "1hour",
  "required_features": ["sma", "regime"],
  "allowed_directions": ["LONG", "SHORT"],
  "max_leverage": "5",
  "stage": "paper",
  "enabled": true
}
